{
  "$schema": "https://json-schema.org/draft/2020-12/schema",
  "$id": "inscription.schema.json",
  "title": "Cypro-Minoan inscription record",
  "type": "object",
  "required": [
    "id",
    "record_version",
    "object",
    "identifiers",
    "assertions",
    "rights"
  ],
  "properties": {
    "id": {
      "type": "string",
      "pattern": "^CMOC-[A-Z0-9][A-Z0-9._-]*$"
    },
    "record_version": {
      "type": "string"
    },
    "identifiers": {
      "type": "array",
      "items": {
        "type": "object",
        "required": [
          "system",
          "value",
          "source_id"
        ],
        "properties": {
          "system": {
            "type": "string"
          },
          "value": {
            "type": "string"
          },
          "source_id": {
            "type": "string"
          }
        },
        "additionalProperties": false
      }
    },
    "object": {
      "type": "object",
      "properties": {
        "object_type": {
          "type": [
            "string",
            "null"
          ]
        },
        "material": {
          "type": [
            "string",
            "null"
          ]
        },
        "repository": {
          "type": [
            "string",
            "null"
          ]
        },
        "inventory_number": {
          "type": [
            "string",
            "null"
          ]
        }
      },
      "additionalProperties": false
    },
    "find_context": {
      "type": "object"
    },
    "dating": {
      "type": "array",
      "items": {
        "$ref": "assertion.schema.json"
      }
    },
    "classifications": {
      "type": "array",
      "items": {
        "$ref": "assertion.schema.json"
      }
    },
    "transcriptions": {
      "type": "array",
      "items": {
        "type": "object",
        "required": [
          "status",
          "source_id",
          "segments"
        ],
        "properties": {
          "status": {
            "enum": [
              "published",
              "independent_observation",
              "project_derived"
            ]
          },
          "source_id": {
            "type": "string"
          },
          "locator": {
            "type": "string"
          },
          "normalization_note": {
            "type": "string"
          },
          "segments": {
            "type": "array",
            "items": {
              "type": "object"
            }
          }
        },
        "additionalProperties": false
      }
    },
    "assertions": {
      "type": "array",
      "items": {
        "$ref": "assertion.schema.json"
      }
    },
    "rights": {
      "type": "object",
      "required": [
        "record_license",
        "third_party_material"
      ],
      "properties": {
        "record_license": {
          "type": "string"
        },
        "third_party_material": {
          "type": "array",
          "items": {
            "type": "object"
          }
        }
      },
      "additionalProperties": false
    },
    "notes": {
      "type": "array",
      "items": {
        "type": "string"
      }
    }
  },
  "additionalProperties": false
}
