{
  "id": "CMOC-0026",
  "record_version": "4.0.0",
  "identifiers": [
    {
      "system": "Louvre inventory",
      "value": "AM 2226",
      "source_id": "louvre-cm-26"
    },
    {
      "system": "excavation inventory",
      "value": "Enk. 49 4072",
      "source_id": "louvre-cm-26"
    },
    {
      "system": "Ferrara 2013 catalogue",
      "value": "26",
      "source_id": "louvre-cm-26"
    },
    {
      "system": "Olivier 2007 catalogue",
      "value": "26",
      "source_id": "louvre-cm-26"
    }
  ],
  "object": {
    "object_type": "inscribed clay ball",
    "material": "clay",
    "repository": "Musée du Louvre, Département des Antiquités orientales",
    "inventory_number": "AM 2226"
  },
  "find_context": {
    "findplace": "Enkomi",
    "source_id": "louvre-cm-26"
  },
  "dating": [
    {
      "assertion_type": "museum_date_range",
      "value": {
        "label": "Late Cypriot",
        "start_bce": 1600,
        "end_bce": 1050
      },
      "status": "published",
      "uncertainty": "certain",
      "provenance": [
        {
          "source_id": "louvre-cm-26",
          "locator": "museum record, Date"
        }
      ]
    }
  ],
  "classifications": [
    {
      "assertion_type": "traditional_classification",
      "value": "CM1",
      "status": "published",
      "uncertainty": "certain",
      "provenance": [
        {
          "source_id": "louvre-cm-26",
          "locator": "museum record, Inscriptions"
        }
      ]
    }
  ],
  "transcriptions": [],
  "assertions": [
    {
      "assertion_type": "script_classification",
      "value": "CM1",
      "status": "published",
      "uncertainty": "certain",
      "provenance": [
        {
          "source_id": "louvre-cm-26",
          "locator": "museum record, Inscriptions"
        }
      ]
    },
    {
      "assertion_type": "sign_count",
      "value": 5,
      "status": "published",
      "uncertainty": "certain",
      "provenance": [
        {
          "source_id": "louvre-cm-26",
          "locator": "museum record, Description"
        }
      ]
    },
    {
      "assertion_type": "discovery_year",
      "value": 1949,
      "status": "published",
      "uncertainty": "certain",
      "provenance": [
        {
          "source_id": "louvre-cm-26",
          "locator": "museum record, Places and dates"
        }
      ]
    },
    {
      "assertion_type": "published_cross_reference",
      "value": {
        "ferrara_2013_catalogue": 26,
        "ferrara_pages": "24",
        "olivier_2007_catalogue": 26,
        "olivier_page": "76"
      },
      "status": "published",
      "uncertainty": "certain",
      "provenance": [
        {
          "source_id": "louvre-cm-26",
          "locator": "museum record, Bibliography"
        }
      ]
    }
  ],
  "rights": {
    "record_license": "Project-original structured metadata; third-party assertions retain attribution",
    "third_party_material": []
  },
  "notes": [
    "Pilot record. No transcription or image copied from Olivier, Ferrara, or the Louvre. Catalogue cross-references are reported from the Louvre museum record, not independently verified against the books in this release."
  ]
}
