{"id":"CMOC-0001","record_version":"0.1.0","identifiers":[],"object":{"object_type":null,"material":null,"repository":null,"inventory_number":null},"find_context":{},"dating":[],"classifications":[],"transcriptions":[],"assertions":[],"rights":{"record_license":"MIT for project-original structure/metadata only; evaluate third-party rights per field","third_party_material":[]},"notes":["TEMPLATE ONLY — not a corpus attestation."]}
